pattern	chi2	cs	en
ADV ADV SCONJ ADJ	3.903225806451613	51	73
ADP DET VERB NOUN	4.332120109190173	515	584
DET VERB NOUN ADP NOUN	4.469767441860465	461	399
NOUN ADP NOUN ADP NOUN NOUN PUNCT	4.629357798165137	774	861
DET ADV ADJ NOUN PUNCT	4.876379690949228	250	203
NUM NUM	6.0	60	90
SYM	6.11864406779661	20	39
NOUN ADP NUM	6.459244532803181	280	223
AUX DET VERB NOUN	6.666666666666667	100	140
NOUN VERB ADP NOUN PART NOUN PUNCT VERB PROPN	7.0	0	7
SYM NUM SYM NUM	7.0	0	7
SCONJ DET NOUN AUX	7.009708737864078	84	122
NOUN VERB ADP NOUN PART NOUN CCONJ NOUN PUNCT VERB PROPN	8.0	0	8
ADP DET ADJ PUNCT ADJ CCONJ ADJ NOUN	8.0	24	48
PRON ADV ADV VERB	8.0	99	63
SCONJ VERB CCONJ VERB	8.066666666666666	51	84
PUNCT PROPN PUNCT PROPN ADJ PUNCT	8.1	29	11
NOUN ADP PROPN ADJ NOUN PUNCT VERB PROPN	8.333333333333334	1	11
ADP ADJ PROPN	9.257142857142858	88	52
ADJ NOUN AUX VERB	9.35027027027027	416	509
ADJ ADJ PROPN ADJ PROPN NUM PUNCT	10.0	10	0
PUNCT INTJ PUNCT NOUN PROPN PUNCT	10.0	0	10
ADP ADJ PUNCT	10.060362173038229	547	447
NOUN ADP ADJ NOUN PUNCT VERB PROPN	10.465116279069768	28	58
DET ADJ PUNCT ADJ NOUN	10.472295514511874	158	221
NUM ADP ADJ NOUN	10.755555555555556	112	68
CCONJ VERB PRON	10.845102505694761	185	254
AUX VERB AUX ADJ	10.903225806451612	150	98
ADJ NOUN ADP NOUN ADP DET NOUN PUNCT NOUN NUM PUNCT VERB PROPN	11.0	0	11
ADP DET ADJ NUM NOUN PUNCT	11.307692307692308	9	30
ADP PRON ADJ NOUN CCONJ	11.628930817610064	58	101
ADP NUM PUNCT	11.813895781637717	236	167
ADV SCONJ NUM SYM	12.0	12	0
AUX PRON VERB	12.9438202247191	404	308
DET NUM SYM NOUN	13.37037037037037	4	23
PROPN CCONJ PROPN	13.448	42	83
SCONJ ADV VERB	14.019417475728156	244	168
ADJ NOUN PUNCT NOUN NUM PUNCT VERB PROPN	14.222222222222221	1	17
ADV SCONJ NUM NUM NOUN	14.222222222222221	17	1
AUX AUX	14.4	27	63
DET ADJ PUNCT	14.400921658986174	480	605
DET ADV ADJ NOUN	14.812765957446809	88	147
NOUN ADP NOUN ADP NOUN ADP ADJ NOUN PUNCT NOUN CCONJ DET NOUN ADP NOUN PUNCT NOUN	15.210526315789474	1	18
PRON ADV VERB	15.304347826086957	297	209
DET NOUN	15.365824308062574	472	359
ADP NOUN CCONJ NOUN PUNCT	15.505567928730512	508	390
PRON DET VERB	15.8	237	158
SCONJ DET NOUN	15.941323345817727	344	457
PART ADV VERB	16.078260869565216	36	79
DET PUNCT PRON VERB	16.24024024024024	281	385
PUNCT PROPN PUNCT PROPN PROPN PUNCT NOUN CCONJ NOUN PUNCT	17.285714285714285	3	25
ADP PROPN	18.158953722334005	201	296
PUNCT NOUN PUNCT PROPN PROPN PUNCT NOUN CCONJ NOUN PUNCT	18.181818181818183	1	21
ADP DET ADV ADJ NOUN	19.240469208211145	130	211
DET PROPN	19.513513513513512	18	56
NOUN ADP NOUN CCONJ NOUN PUNCT VERB PROPN	19.7027027027027	5	32
PART AUX	19.88235294117647	4	30
NOUN ADP DET NOUN PUNCT PUNCT PUNCT PROPN PUNCT	20.166666666666668	1	23
PROPN ADP DET NOUN PUNCT PUNCT PROPN PROPN PUNCT	21.0	0	21
INTJ	21.0	0	21
ADP PRON ADJ NOUN	21.751020408163264	86	159
PUNCT PROPN PUNCT PROPN PROPN PUNCT PROPN PUNCT NOUN CCONJ NOUN PUNCT	22.0	0	22
ADP NUM PROPN NUM	22.0	0	22
ADJ PUNCT ADJ CCONJ ADJ PUNCT	22.05	61	19
NUM SYM NUM PUNCT	23.14814814814815	1	26
NUM	23.775280898876403	132	224
AUX AUX ADV VERB PUNCT	24.142857142857142	12	51
PROPN AUX	24.894117647058824	124	216
ADP PRON ADJ NOUN PUNCT	25.691629955947135	173	281
AUX DET NOUN ADJ	25.798657718120804	236	360
PUNCT NOUN PUNCT X	26.0	0	26
ADP ADJ PROPN PUNCT	26.456869009584665	202	111
NOUN ADP DET NOUN PUNCT PUNCT PUNCT NOUN PUNCT	26.5609756097561	4	37
AUX AUX ADJ	27.28391167192429	112	205
AUX DET ADV ADJ	29.357798165137616	69	149
ADV AUX VERB	29.588055130168453	257	396
ADJ	30.339105339105338	419	274
CCONJ ADV VERB	30.852233676975946	358	224
PUNCT DET NOUN AUX VERB ADP NUM NOUN CCONJ VERB ADP NUM NOUN PUNCT	31.0	0	31
NOUN PUNCT VERB PROPN	32.24817518248175	90	184
X	34.0	0	34
ADJ PUNCT ADJ CCONJ ADJ NOUN	34.61538461538461	82	22
PROPN SCONJ ADV VERB PUNCT VERB PROPN	35.0	0	35
NOUN ADP NOUN CCONJ NOUN NOUN PUNCT VERB PROPN	35.1025641025641	1	38
SCONJ	35.35804195804196	437	278
ADP PROPN NUM PUNCT	35.88659793814433	19	78
PROPN ADP DET NOUN PUNCT PUNCT	36.48051948051948	12	65
AUX ADV ADJ	37.22466960352423	292	162
SCONJ PROPN PROPN VERB PUNCT	37.355555555555554	2	43
AUX PART ADV VERB	39.18518518518518	4	50
AUX PRON ADJ PUNCT SCONJ	39.340425531914896	45	2
NUM NUM NUM	39.340425531914896	2	45
ADJ NOUN ADP ADJ ADJ PUNCT ADJ	39.34710743801653	95	26
NOUN ADP NOUN VERB ADP DET NOUN PUNCT VERB PROPN	40.09090909090909	1	43
ADP DET ADJ PROPN NOUN PUNCT	40.69491525423729	5	54
PRON ADV AUX VERB PART VERB	41.0	0	41
ADP NUM PROPN NUM PUNCT	41.08888888888889	1	44
DET ADJ	41.53187613843352	199	350
ADP PROPN CCONJ PROPN PUNCT	42.29323308270677	29	104
NUM PUNCT NUM PUNCT	43.61290322580645	57	5
PART	44.78698224852071	128	41
DET DET NOUN PUNCT	44.82666666666667	218	382
NOUN ADP PROPN ADP ADJ NOUN PUNCT VERB PROPN	45.301886792452834	2	51
ADP NOUN ADP DET PROPN PROPN PUNCT PUNCT PUNCT PROPN PUNCT PROPN PROPN PUNCT	46.0	0	46
ADJ CCONJ ADV ADJ	47.41463414634146	177	69
ADP DET ADJ CCONJ ADJ NOUN	47.532934131736525	104	230
AUX ADV VERB	47.67350427350427	376	209
PUNCT PROPN PUNCT ADJ NOUN ADJ PUNCT	48.05714285714286	64	6
AUX AUX VERB	48.858156028368796	29	112
PART AUX ADV ADJ	49.59016393442623	3	58
ADP ADJ NUM NOUN	49.7787610619469	94	19
ADP PRON PUNCT	52.12403100775194	176	340
ADP NOUN ADP DET PROPN PUNCT PROPN PROPN PUNCT PUNCT	55.0	0	55
INTJ PUNCT	55.0	0	55
NUM NOUN NUM	56.22522522522522	95	16
PUNCT DET PRON ADV VERB	56.627450980392155	89	13
PRON AUX PUNCT ADV PUNCT	56.822784810126585	6	73
AUX PART	57.6	32	128
ADJ CCONJ ADJ NOUN	59.220640569395016	205	76
ADP PROPN CCONJ	59.282051282051285	88	224
PROPN PUNCT PROPN PUNCT	59.50413223140496	61	181
PROPN AUX VERB	59.53982300884956	55	171
NOUN ADP NOUN PUNCT VERB PROPN	60.57046979865772	27	122
AUX PART ADJ PUNCT	62.241379310344826	25	120
PUNCT DET NOUN AUX VERB ADP NUM NOUN PUNCT	64.05882352941177	1	67
ADP DET NUM NOUN	64.22222222222223	30	132
PROPN PUNCT	65.83451536643027	541	305
ADP NUM NOUN	68.72199170124482	332	150
PROPN PART NOUN	71.02061855670104	7	90
AUX ADV AUX VERB PUNCT	72.00869565217391	12	103
ADJ NOUN PUNCT NOUN NUM PUNCT	73.08695652173913	87	5
PRON AUX	74.58677685950413	13	108
ADJ CCONJ ADJ PUNCT	75.0	225	75
NOUN ADP PROPN CCONJ PROPN	75.08205128205128	37	158
SCONJ PRON AUX	75.7032967032967	4	87
ADJ NOUN PUNCT DET AUX	76.01351351351352	223	73
PRON AUX ADV ADV VERB	76.22222222222223	14	112
PROPN	76.234404536862	671	387
AUX DET PROPN VERB	77.0	0	77
DET NOUN ADP ADJ PROPN	78.0695652173913	48	182
PUNCT PROPN PUNCT NOUN ADJ PUNCT	78.86666666666666	98	7
ADP NOUN PUNCT PUNCT PUNCT PROPN PUNCT	80.01010101010101	5	94
PRON AUX AUX	80.83177570093459	7	100
ADP PRON	81.59433962264151	119	305
PRON AUX AUX ADV ADJ	84.375	3	93
ADP NOUN ADP DET PROPN PROPN PUNCT PUNCT	86.0	0	86
PRON AUX ADJ PUNCT	86.09782608695652	95	273
PART ADJ NOUN	87.14893617021276	30	158
PROPN PROPN CCONJ PROPN PROPN PUNCT	87.16842105263157	2	93
PRON AUX PART ADV VERB	89.0	0	89
ADJ NOUN CCONJ VERB	90.61496149614962	598	311
ADJ PUNCT ADJ CCONJ ADJ NOUN PUNCT	90.68571428571428	174	36
ADJ NOUN ADJ PRON	91.87390029325513	259	82
AUX ADV ADJ PUNCT SCONJ	94.20253164556962	140	18
SCONJ DET PROPN NOUN	94.58181818181818	4	106
ADV ADV VERB	95.10543130990415	435	191
ADP NOUN	95.51824431517716	1158	733
NOUN CCONJ NOUN	95.79504289799809	683	366
AUX PRON PART	95.8695652173913	5	110
PRON AUX AUX ADJ PART VERB	96.0	0	96
AUX ADV AUX VERB ADP	96.98507462686567	10	124
ADP DET PROPN PROPN PROPN CCONJ	97.0	0	97
ADP	97.63556851311954	80	263
PRON AUX ADV ADJ SCONJ	98.1900826446281	6	115
PRON AUX PART	99.14953271028037	2	105
ADP DET PUNCT SCONJ	100.83953033268102	369	142
PROPN PROPN PART NOUN	102.0	0	102
DET PROPN ADV VERB	103.50769230769231	7	123
AUX ADV ADJ PUNCT	104.6639344262295	357	131
PUNCT	107.09319986192612	1727	1170
ADP ADJ ADJ NOUN CCONJ	107.4060475161987	343	120
PRON AUX ADV ADJ PUNCT	111.21804511278195	47	219
DET ADJ ADJ NOUN	111.67441860465117	492	884
ADP ADJ ADJ NOUN	112.73458445040214	518	228
PRON ADV VERB PART VERB	116.03333333333333	1	119
ADP DET ADJ	116.25053533190578	117	350
DET ADJ NOUN AUX DET NOUN PUNCT	117.63316582914572	23	176
PROPN PROPN PUNCT	117.81818181818181	90	306
DET PROPN PART	119.0	0	119
NOUN AUX ADV AUX VERB	119.17241379310344	15	159
PRON AUX ADJ	120.1711229946524	81	293
DET PROPN PROPN	120.53164556962025	10	148
PART NOUN AUX	121.0	6	138
AUX ADJ PART VERB	123.6993006993007	5	138
ADP ADJ NOUN CCONJ	126.12983662940671	773	390
SCONJ DET ADJ NOUN AUX VERB	129.39520958083833	10	157
PRON AUX AUX ADJ	129.64615384615385	18	177
VERB PUNCT SCONJ PRON VERB	130.1413881748072	307	82
PUNCT PROPN PUNCT PROPN PROPN PUNCT	130.41798941798942	16	173
PRON AUX ADV ADJ PART VERB	131.0	0	131
PRON AUX ADV ADJ	132.48076923076923	21	187
SCONJ VERB	140.5127978817299	766	367
PRON ADJ PART VERB	143.0	0	143
PART AUX ADJ	143.61621621621623	11	174
PRON NOUN VERB PART VERB	145.0268456375839	1	148
PRON AUX ADV AUX VERB	149.0261437908497	1	152
SCONJ DET PROPN PROPN	149.0261437908497	1	152
PROPN PROPN PROPN PUNCT	149.4377358490566	33	232
ADJ CCONJ ADJ NOUN PUNCT	151.13577981651378	416	129
ADP NOUN CCONJ ADJ NOUN PUNCT	153.4459308807135	634	263
DET PROPN PART NOUN	155.0	0	155
PRON PRON VERB	155.3506343713956	250	617
DET ADJ PROPN	155.74045801526717	30	232
PRON AUX ADV VERB PART VERB	157.0	0	157
NUM NOUN PUNCT	165.23090586145648	434	129
CCONJ	165.47353760445682	1170	625
AUX PART AUX VERB	166.0	0	166
ADJ ADP PRON	167.80645161290323	126	432
PRON AUX ADJ SCONJ	172.41379310344828	16	216
DET PROPN PROPN PART NOUN	175.0	0	175
NOUN PUNCT DET AUX	179.3840830449827	450	128
NOUN PUNCT DET ADV VERB	180.95616438356166	311	54
ADP PROPN PUNCT	182.34418604651162	232	628
VERB PRON PUNCT SCONJ	188.47138964577655	315	52
PART AUX DET NOUN	189.02072538860102	1	192
SCONJ DET NOUN AUX VERB	189.93768545994067	42	295
DET PROPN VERB	190.72847682119206	31	271
CCONJ DET NOUN	191.83409238776838	497	1040
NOUN ADP NOUN NOUN	192.90393996247656	1691	974
ADJ NOUN AUX	194.43824336688016	777	316
SCONJ PRON VERB	197.7812041116006	157	524
PART ADJ NOUN PUNCT	198.28235294117647	96	414
DET PROPN AUX VERB	199.17061611374407	3	208
ADV ADJ PUNCT	203.75274056029232	615	206
PROPN PROPN AUX VERB	204.44642857142858	5	219
AUX DET NOUN	204.93828351012536	288	749
VERB PRON PUNCT	207.1011235955056	164	548
PRON AUX ADV	208.17562724014337	19	260
ADP DET PUNCT	208.968534906588	278	739
NUM PUNCT	210.94890510948906	444	104
ADP DET PROPN PROPN CCONJ	212.07272727272726	2	218
PUNCT DET PRON VERB	212.448132780083	401	81
ADP ADJ CCONJ ADJ NOUN	214.81643835616438	563	167
AUX VERB	216.26710816777043	383	70
ADP NOUN NUM	216.34280639431617	456	107
CCONJ VERB DET NOUN	217.07655502392345	205	631
PUNCT SCONJ	217.9951690821256	755	280
SCONJ PRON AUX PART VERB	218.0	0	218
ADJ NOUN AUX AUX VERB ADP	224.25096525096524	9	250
ADP PRON NOUN	226.27702702702703	113	479
DET	227.24113475177305	461	103
SCONJ PRON AUX ADJ	229.7174603174603	23	292
PART VERB CCONJ VERB	231.06694560669456	2	237
ADP NOUN PART NOUN	233.75675675675674	27	306
DET NOUN AUX ADV VERB	234.76331360946745	81	426
DET PUNCT PRON AUX	239.48692152917505	76	421
ADP PROPN PROPN	240.7715736040609	43	351
ADJ NOUN CCONJ ADJ NOUN	241.69832402234636	566	150
PRON AUX ADJ PART VERB	243.0	0	243
DET NOUN VERB	246.5232310962648	1196	2097
PRON AUX PART ADJ	247.24334600760457	4	259
PART AUX VERB	251.06177606177607	2	257
PRON VERB PUNCT SCONJ	257.7902097902098	478	94
NOUN ADP NOUN NOUN PUNCT	259.3644444444444	1898	1027
ADP DET NOUN CCONJ NOUN	270.5917098445596	227	738
ADP NOUN PUNCT	270.81938172976726	1881	998
NOUN AUX VERB	275.1044776119403	315	891
DET NOUN CCONJ NOUN ADP	277.8203821656051	159	626
AUX AUX VERB PUNCT	279.7241379310345	18	330
PRON AUX VERB PART VERB	283.0	0	283
DET PROPN PROPN PROPN	293.11803278688524	3	302
AUX	293.60547504025766	524	97
NOUN CCONJ NOUN NOUN PUNCT	293.72226593233677	941	330
PART VERB	293.8793969849246	28	370
ADJ NOUN PUNCT DET AUX ADJ	306.18848167539267	362	20
AUX ADJ PUNCT	307.8206278026906	708	184
AUX ADJ PUNCT SCONJ	309.0660377358491	393	31
DET VERB NOUN ADP DET NOUN	310.2247838616715	115	579
DET PROPN PROPN AUX VERB	316.0	0	316
ADP DET PROPN PROPN PROPN PUNCT	317.01246105919006	1	320
ADP DET PROPN PROPN	324.04819277108436	2	330
ADP DET ADJ NOUN	330.85392051557466	188	743
PART NOUN PUNCT	334.2229965156794	68	506
PRON AUX DET ADJ NOUN PUNCT	334.82750582750583	25	404
NOUN AUX AUX VERB ADP	336.1034482758621	3	345
ADP PRON NOUN PUNCT	338.16901408450707	110	600
PRON AUX PART VERB	345.0	0	345
PRON AUX ADV VERB	345.80860215053764	32	433
PUNCT ADJ NOUN ADJ PUNCT	356.8018018018018	500	55
PRON ADV VERB DET NOUN	359.54781199351703	73	544
SCONJ PRON AUX VERB	361.15744680851066	29	441
ADP DET NOUN PART NOUN	361.4117647058824	12	396
ADP PROPN PROPN PUNCT	362.02371541501975	39	467
ADP DET DET NOUN PUNCT	363.66582278481013	127	663
ADP DET NOUN ADP ADJ NOUN	365.7081712062257	120	651
DET PROPN NOUN	367.60360360360363	20	424
DET NOUN PART NOUN	369.95216400911164	18	421
DET NOUN ADP ADJ NOUN	370.2256203115984	466	1267
DET PROPN PROPN VERB	374.09326424870466	3	383
NOUN PUNCT	376.269548633185	2117	1029
VERB PUNCT SCONJ AUX ADJ	385.46320346320346	442	20
PRON AUX AUX VERB	386.6124401913876	8	410
X PUNCT	388.0	0	388
SCONJ VERB DET NOUN	394.13632030505244	203	846
PART VERB PRON	395.3436754176611	6	413
NOUN CCONJ NOUN PUNCT	396.21303656597775	982	276
AUX PART VERB	426.5589519650655	8	450
AUX DET ADJ NOUN	432.5487012987013	251	981
PART VERB PRON NOUN	439.0357941834452	2	445
PRON AUX VERB PART VERB DET NOUN	448.0	0	448
ADJ NOUN	454.23285899094435	1192	354
ADP DET PROPN	458.47169811320754	33	550
DET NOUN ADP DET PROPN NOUN	464.008547008547	1	467
ADP ADJ NOUN	464.99633923123855	1256	383
AUX ADJ	466.5089209855565	959	218
DET NOUN ADP NOUN CCONJ NOUN	473.8083889418494	172	877
DET NOUN ADP NOUN PUNCT	486.49137451307735	431	1366
ADJ NOUN CCONJ ADJ NOUN PUNCT	486.75390625	865	159
ADJ NOUN CCONJ NOUN	491.26640159045724	1185	324
DET NOUN SCONJ VERB	501.0787589498807	95	743
ADP DET NOUN ADP ADJ NOUN PUNCT	505.6635220125786	235	1037
ADP DET NOUN ADP DET PROPN PROPN	507.0	0	507
ADP DET ADJ NOUN PUNCT	511.2474437627812	478	1478
NOUN PUNCT DET VERB	519.8165898617511	918	167
ADP ADJ ADJ NOUN PUNCT	524.8832731648616	1298	364
DET ADJ NOUN AUX VERB	540.8	48	672
DET ADJ NOUN ADP NOUN	560.6598984771574	318	1258
ADP DET PROPN PROPN PUNCT	561.4317032040473	8	585
PART VERB ADJ NOUN	585.4132730015083	20	643
PRON VERB PART VERB	586.0067796610169	1	589
NOUN PUNCT NOUN ADJ PUNCT	599.5859284890427	794	73
ADP DET NOUN	628.9975384615385	307	1318
ADP DET NOUN ADP NOUN	646.5615062761507	158	1037
DET NOUN AUX VERB	662.8920225624496	167	1074
ADP DET ADJ NOUN ADP NOUN	667.9357541899441	227	1205
ADJ NOUN PUNCT DET VERB	676.4995700773861	1025	138
ADP DET DET NOUN	688.6864654333009	93	934
PRON VERB SCONJ	717.6933638443936	41	833
ADJ NOUN PUNCT	741.3707679603633	1881	541
PUNCT PRON AUX	751.1296572280179	169	1173
ADP DET NOUN PUNCT	756.0314698259904	636	2065
ADJ ADJ NOUN	770.0102564102564	1328	232
VERB PUNCT SCONJ	789.7164750957854	976	68
DET NOUN ADP NOUN	803.4474678760394	146	1177
PRON VERB PRON	865.7146619841967	73	1066
PART VERB DET ADJ NOUN	896.0176991150443	2	902
PRON AUX VERB	1059.9197786998616	104	1342
ADP DET NOUN ADP NOUN PUNCT	1100.469813391877	203	1619
ADP ADJ NOUN PUNCT	1217.2056921086676	2516	576
PART VERB DET NOUN	1268.196923076923	8	1292
PRON AUX DET NOUN	1328.7292225201072	42	1450
ADJ ADJ NOUN PUNCT	1349.9239332096474	1931	225
ADJ NOUN ADP NOUN	1519.4463676894834	3110	703
NOUN	1653.7564122021552	4945	1644
PRON VERB DET NOUN	1855.3492690636112	182	2349
NOUN ADJ PUNCT	2466.4749933844932	3416	363
VERB	3531.389916945942	5893	970
